{
	"$schema": "https://raw.githubusercontent.com/earendil-works/pi/main/packages/coding-agent/src/modes/interactive/theme/theme-schema.json",
	"name": "tokyo-night",
	"vars": {
		"bg": "#1a1b26",
		"bgAlt": "#1f2335",
		"bgHighlight": "#292e42",
		"bgSelected": "#2f3548",
		"comment": "#565f89",
		"fg": "#c0caf5",
		"fgDark": "#a9b1d6",
		"fgGutter": "#3b4261",
		"blue": "#7aa2f7",
		"cyan": "#7dcfff",
		"green": "#73daca",
		"green2": "#9ece6a",
		"orange": "#ff9e64",
		"purple": "#9d7cd8",
		"red": "#f7768e",
		"teal": "#1abc9c",
		"yellow": "#e0af68",
		"terminalBlack": "#414868"
	},
	"colors": {
		"accent": "blue",
		"border": "bgHighlight",
		"borderAccent": "blue",
		"borderMuted": "fgGutter",
		"success": "green",
		"error": "red",
		"info": "cyan",
		"warning": "yellow",
		"muted": "comment",
		"dim": "comment",
		"text": "fg",
		"thinkingText": "comment",
		"selectedBg": "bgSelected",
		"userMessageBg": "bg",
		"userMessageText": "fg",
		"customMessageBg": "bgAlt",
		"customMessageText": "fg",
		"customMessageLabel": "purple",
		"toolPendingBg": "bgAlt",
		"toolSuccessBg": "bg",
		"toolErrorBg": "bg",
		"toolTitle": "fg",
		"toolOutput": "comment",
		"mdHeading": "orange",
		"mdLink": "blue",
		"mdLinkUrl": "comment",
		"mdCode": "cyan",
		"mdCodeBlock": "green2",
		"mdCodeBlockBorder": "fgGutter",
		"mdQuote": "comment",
		"mdQuoteBorder": "fgGutter",
		"mdHr": "fgGutter",
		"mdListBullet": "cyan",
		"toolDiffAdded": "green",
		"toolDiffRemoved": "red",
		"toolDiffContext": "comment",
		"syntaxComment": "comment",
		"syntaxKeyword": "purple",
		"syntaxFunction": "blue",
		"syntaxVariable": "fg",
		"syntaxString": "green2",
		"syntaxNumber": "orange",
		"syntaxType": "cyan",
		"syntaxOperator": "fg",
		"syntaxPunctuation": "fg",
		"thinkingOff": "fgGutter",
		"thinkingMinimal": "comment",
		"thinkingLow": "blue",
		"thinkingMedium": "cyan",
		"thinkingHigh": "purple",
		"thinkingXhigh": "orange",
		"thinkingMax": "red",
		"bashMode": "green",
		"pythonMode": "green",
		"statusLineSep": "bgHighlight",
		"statusLineModel": "blue",
		"statusLinePath": "fg",
		"statusLineGitClean": "green",
		"statusLineGitDirty": "yellow",
		"statusLineContext": "comment",
		"statusLineSpend": "comment",
		"statusLineStaged": "blue",
		"statusLineDirty": "yellow",
		"statusLineUntracked": "comment",
		"statusLineOutput": "fg",
		"statusLineCost": "comment",
		"statusLineSubagents": "comment",
		"statusLineBg": "bg"
	},
	"export": {
		"pageBg": "#1a1b26",
		"cardBg": "#1f2335",
		"infoBg": "#292e42"
	}
}
