{
	"$schema": "https://raw.githubusercontent.com/earendil-works/pi/main/packages/coding-agent/src/modes/interactive/theme/theme-schema.json",
	"name": "dark",
	"vars": {
		"cyan": "#00d7ff",
		"blue": "#5f87ff",
		"green": "#b5bd68",
		"red": "#cc6666",
		"yellow": "#ffff00",
		"text": "#d4d4d4",
		"gray": "#808080",
		"dimGray": "#666666",
		"darkGray": "#505050",
		"accent": "#8abeb7",
		"selectedBg": "#3a3a4a",
		"userMsgBg": "#343541",
		"toolPendingBg": "#282832",
		"toolSuccessBg": "#283228",
		"toolErrorBg": "#3c2828",
		"customMsgBg": "#2d2838"
	},
	"colors": {
		"accent": "accent",
		"border": "blue",
		"borderAccent": "cyan",
		"borderMuted": "darkGray",
		"success": "green",
		"error": "red",
		"info": "#5f87af",
		"warning": "yellow",
		"muted": "gray",
		"dim": "dimGray",
		"text": "text",
		"thinkingText": "gray",
		"selectedBg": "selectedBg",
		"userMessageBg": "userMsgBg",
		"userMessageText": "text",
		"customMessageBg": "customMsgBg",
		"customMessageText": "text",
		"customMessageLabel": "#9575cd",
		"toolPendingBg": "toolPendingBg",
		"toolSuccessBg": "toolSuccessBg",
		"toolErrorBg": "toolErrorBg",
		"toolTitle": "text",
		"toolOutput": "gray",
		"mdHeading": "#f0c674",
		"mdLink": "#81a2be",
		"mdLinkUrl": "dimGray",
		"mdCode": "accent",
		"mdCodeBlock": "green",
		"mdCodeBlockBorder": "gray",
		"mdQuote": "gray",
		"mdQuoteBorder": "gray",
		"mdHr": "gray",
		"mdListBullet": "accent",
		"toolDiffAdded": "green",
		"toolDiffRemoved": "red",
		"toolDiffContext": "gray",
		"syntaxComment": "#6A9955",
		"syntaxKeyword": "#569CD6",
		"syntaxFunction": "#DCDCAA",
		"syntaxVariable": "#9CDCFE",
		"syntaxString": "#CE9178",
		"syntaxNumber": "#B5CEA8",
		"syntaxType": "#4EC9B0",
		"syntaxOperator": "#D4D4D4",
		"syntaxPunctuation": "#D4D4D4",
		"thinkingOff": "darkGray",
		"thinkingMinimal": "#6e6e6e",
		"thinkingLow": "#5f87af",
		"thinkingMedium": "#81a2be",
		"thinkingHigh": "#b294bb",
		"thinkingXhigh": "#d183e8",
		"thinkingMax": "#ff5fff",
		"bashMode": "green",
		"pythonMode": "green",
		"statusLineSep": "blue",
		"statusLineModel": "accent",
		"statusLinePath": "text",
		"statusLineGitClean": "green",
		"statusLineGitDirty": "yellow",
		"statusLineContext": "gray",
		"statusLineSpend": "gray",
		"statusLineStaged": "accent",
		"statusLineDirty": "yellow",
		"statusLineUntracked": "gray",
		"statusLineOutput": "text",
		"statusLineCost": "gray",
		"statusLineSubagents": "gray",
		"statusLineBg": "userMsgBg"
	},
	"export": {
		"pageBg": "#18181e",
		"cardBg": "#1e1e24",
		"infoBg": "#3c3728"
	}
}
