{
	"$schema": "https://raw.githubusercontent.com/earendil-works/pi/main/packages/coding-agent/src/modes/interactive/theme/theme-schema.json",
	"name": "nord",
	"vars": {
		"polarNight1": "#2e3440",
		"polarNight2": "#3b4252",
		"polarNight3": "#434c5e",
		"polarNight4": "#4c566a",
		"snowStorm1": "#d8dee9",
		"snowStorm2": "#e5e9f0",
		"snowStorm3": "#eceff4",
		"frost1": "#8fbcbb",
		"frost2": "#88c0d0",
		"frost3": "#81a1c1",
		"frost4": "#5e81ac",
		"auroraRed": "#bf616a",
		"auroraOrange": "#d08770",
		"auroraYellow": "#ebcb8b",
		"auroraGreen": "#a3be8c",
		"auroraPurple": "#b48ead"
	},
	"colors": {
		"accent": "frost2",
		"border": "frost4",
		"borderAccent": "frost2",
		"borderMuted": "polarNight3",
		"success": "auroraGreen",
		"error": "auroraRed",
		"info": "frost4",
		"warning": "auroraYellow",
		"muted": "polarNight4",
		"dim": "polarNight4",
		"text": "snowStorm1",
		"thinkingText": "polarNight4",
		"selectedBg": "polarNight2",
		"userMessageBg": "polarNight2",
		"userMessageText": "snowStorm1",
		"customMessageBg": "polarNight2",
		"customMessageText": "snowStorm1",
		"customMessageLabel": "auroraPurple",
		"toolPendingBg": "polarNight2",
		"toolSuccessBg": "polarNight1",
		"toolErrorBg": "polarNight1",
		"toolTitle": "snowStorm1",
		"toolOutput": "polarNight4",
		"mdHeading": "auroraYellow",
		"mdLink": "frost3",
		"mdLinkUrl": "polarNight4",
		"mdCode": "frost2",
		"mdCodeBlock": "auroraGreen",
		"mdCodeBlockBorder": "polarNight4",
		"mdQuote": "polarNight4",
		"mdQuoteBorder": "polarNight4",
		"mdHr": "polarNight4",
		"mdListBullet": "frost2",
		"toolDiffAdded": "auroraGreen",
		"toolDiffRemoved": "auroraRed",
		"toolDiffContext": "polarNight4",
		"syntaxComment": "polarNight4",
		"syntaxKeyword": "frost3",
		"syntaxFunction": "auroraYellow",
		"syntaxVariable": "snowStorm1",
		"syntaxString": "auroraGreen",
		"syntaxNumber": "auroraPurple",
		"syntaxType": "frost2",
		"syntaxOperator": "snowStorm1",
		"syntaxPunctuation": "snowStorm1",
		"thinkingOff": "polarNight4",
		"thinkingMinimal": "polarNight4",
		"thinkingLow": "frost4",
		"thinkingMedium": "frost3",
		"thinkingHigh": "auroraPurple",
		"thinkingXhigh": "auroraOrange",
		"thinkingMax": "auroraRed",
		"bashMode": "auroraGreen",
		"pythonMode": "auroraGreen",
		"statusLineSep": "frost4",
		"statusLineModel": "frost2",
		"statusLinePath": "snowStorm1",
		"statusLineGitClean": "auroraGreen",
		"statusLineGitDirty": "auroraYellow",
		"statusLineContext": "polarNight4",
		"statusLineSpend": "polarNight4",
		"statusLineStaged": "frost2",
		"statusLineDirty": "auroraYellow",
		"statusLineUntracked": "polarNight4",
		"statusLineOutput": "snowStorm1",
		"statusLineCost": "polarNight4",
		"statusLineSubagents": "polarNight4",
		"statusLineBg": "polarNight2"
	},
	"export": {
		"pageBg": "#2e3440",
		"cardBg": "#3b4252",
		"infoBg": "#434c5e"
	}
}
