{
	"$schema": "https://raw.githubusercontent.com/earendil-works/pi/main/packages/coding-agent/src/modes/interactive/theme/theme-schema.json",
	"name": "gruvbox",
	"vars": {
		"bg0": "#282828",
		"bg1": "#3c3836",
		"bg2": "#504945",
		"bg3": "#665c54",
		"bg4": "#7c6f64",
		"fg0": "#fbf1c7",
		"fg1": "#ebdbb2",
		"fg2": "#d5c4a1",
		"fg3": "#bdae93",
		"fg4": "#a89984",
		"red": "#cc241d",
		"green": "#98971a",
		"yellow": "#d79921",
		"blue": "#458588",
		"purple": "#b16286",
		"aqua": "#689d6a",
		"orange": "#d65d0e",
		"gray": "#928374",
		"brightRed": "#fb4934",
		"brightGreen": "#b8bb26",
		"brightYellow": "#fabd2f",
		"brightBlue": "#83a598",
		"brightPurple": "#d3869b",
		"brightAqua": "#8ec07c",
		"brightOrange": "#fe8019"
	},
	"colors": {
		"accent": "brightAqua",
		"border": "bg3",
		"borderAccent": "brightAqua",
		"borderMuted": "bg3",
		"success": "brightGreen",
		"error": "brightRed",
		"info": "brightBlue",
		"warning": "brightYellow",
		"muted": "fg4",
		"dim": "bg4",
		"text": "fg1",
		"thinkingText": "fg4",
		"selectedBg": "bg1",
		"userMessageBg": "bg0",
		"userMessageText": "fg1",
		"customMessageBg": "bg1",
		"customMessageText": "fg1",
		"customMessageLabel": "brightPurple",
		"toolPendingBg": "bg1",
		"toolSuccessBg": "bg0",
		"toolErrorBg": "bg0",
		"toolTitle": "fg1",
		"toolOutput": "fg4",
		"mdHeading": "brightYellow",
		"mdLink": "brightBlue",
		"mdLinkUrl": "fg4",
		"mdCode": "brightAqua",
		"mdCodeBlock": "brightGreen",
		"mdCodeBlockBorder": "bg3",
		"mdQuote": "fg4",
		"mdQuoteBorder": "bg3",
		"mdHr": "bg3",
		"mdListBullet": "brightAqua",
		"toolDiffAdded": "brightGreen",
		"toolDiffRemoved": "brightRed",
		"toolDiffContext": "fg4",
		"syntaxComment": "gray",
		"syntaxKeyword": "brightBlue",
		"syntaxFunction": "brightYellow",
		"syntaxVariable": "fg1",
		"syntaxString": "brightGreen",
		"syntaxNumber": "brightPurple",
		"syntaxType": "brightAqua",
		"syntaxOperator": "fg1",
		"syntaxPunctuation": "fg1",
		"thinkingOff": "bg3",
		"thinkingMinimal": "bg4",
		"thinkingLow": "brightBlue",
		"thinkingMedium": "brightAqua",
		"thinkingHigh": "brightPurple",
		"thinkingXhigh": "brightOrange",
		"thinkingMax": "brightRed",
		"bashMode": "brightGreen",
		"pythonMode": "brightGreen",
		"statusLineSep": "bg3",
		"statusLineModel": "brightAqua",
		"statusLinePath": "fg1",
		"statusLineGitClean": "brightGreen",
		"statusLineGitDirty": "brightYellow",
		"statusLineContext": "fg4",
		"statusLineSpend": "fg4",
		"statusLineStaged": "brightAqua",
		"statusLineDirty": "brightYellow",
		"statusLineUntracked": "fg4",
		"statusLineOutput": "fg1",
		"statusLineCost": "fg4",
		"statusLineSubagents": "fg4",
		"statusLineBg": "bg0"
	},
	"export": {
		"pageBg": "#282828",
		"cardBg": "#3c3836",
		"infoBg": "#504945"
	}
}
