{
	"$schema": "https://raw.githubusercontent.com/earendil-works/pi/main/packages/coding-agent/src/modes/interactive/theme/theme-schema.json",
	"name": "catppuccin",
	"vars": {
		"base": "#1e1e2e",
		"mantle": "#181825",
		"crust": "#11111b",
		"surface0": "#313244",
		"surface1": "#45475a",
		"surface2": "#585b70",
		"overlay0": "#6c7086",
		"overlay1": "#7f849c",
		"subtext0": "#a6adc8",
		"subtext1": "#bac2de",
		"text": "#cdd6f4",
		"lavender": "#b4befe",
		"blue": "#89b4fa",
		"sapphire": "#74c7ec",
		"sky": "#89dceb",
		"teal": "#94e2d5",
		"green": "#a6e3a1",
		"yellow": "#f9e2af",
		"peach": "#fab387",
		"maroon": "#eba0ac",
		"red": "#f38ba8",
		"mauve": "#cba6f7",
		"pink": "#f5c2e7",
		"flamingo": "#f2cdcd",
		"rosewater": "#f5e0dc"
	},
	"colors": {
		"accent": "mauve",
		"border": "surface1",
		"borderAccent": "mauve",
		"borderMuted": "surface0",
		"success": "green",
		"error": "red",
		"info": "sapphire",
		"warning": "yellow",
		"muted": "overlay0",
		"dim": "surface2",
		"text": "text",
		"thinkingText": "overlay1",
		"selectedBg": "surface0",
		"userMessageBg": "mantle",
		"userMessageText": "text",
		"customMessageBg": "surface0",
		"customMessageText": "text",
		"customMessageLabel": "pink",
		"toolPendingBg": "surface0",
		"toolSuccessBg": "mantle",
		"toolErrorBg": "mantle",
		"toolTitle": "text",
		"toolOutput": "overlay0",
		"mdHeading": "peach",
		"mdLink": "blue",
		"mdLinkUrl": "overlay0",
		"mdCode": "teal",
		"mdCodeBlock": "green",
		"mdCodeBlockBorder": "surface1",
		"mdQuote": "overlay0",
		"mdQuoteBorder": "surface0",
		"mdHr": "surface1",
		"mdListBullet": "teal",
		"toolDiffAdded": "green",
		"toolDiffRemoved": "red",
		"toolDiffContext": "overlay0",
		"syntaxComment": "overlay0",
		"syntaxKeyword": "mauve",
		"syntaxFunction": "blue",
		"syntaxVariable": "text",
		"syntaxString": "green",
		"syntaxNumber": "peach",
		"syntaxType": "teal",
		"syntaxOperator": "text",
		"syntaxPunctuation": "text",
		"thinkingOff": "surface0",
		"thinkingMinimal": "surface2",
		"thinkingLow": "sapphire",
		"thinkingMedium": "teal",
		"thinkingHigh": "mauve",
		"thinkingXhigh": "peach",
		"thinkingMax": "red",
		"bashMode": "green",
		"pythonMode": "green",
		"statusLineSep": "surface1",
		"statusLineModel": "mauve",
		"statusLinePath": "text",
		"statusLineGitClean": "green",
		"statusLineGitDirty": "yellow",
		"statusLineContext": "overlay0",
		"statusLineSpend": "overlay0",
		"statusLineStaged": "mauve",
		"statusLineDirty": "yellow",
		"statusLineUntracked": "overlay0",
		"statusLineOutput": "text",
		"statusLineCost": "overlay0",
		"statusLineSubagents": "overlay0",
		"statusLineBg": "mantle"
	},
	"export": {
		"pageBg": "#1e1e2e",
		"cardBg": "#181825",
		"infoBg": "#313244"
	}
}
